{
    "$schema": "https://json-schema.org/draft/2020-12/schema",
    "$id": "https://raw.githubusercontent.com/UCLALibrary/sinai_metadata/master/data-model/jsonschemas/agent.json",
    "title": "Agent",
    "description": "A record for an agent, either an individual or an organization, capable of acting in the production of material objects or creation of conceptual works",
    "type": "object",
    "properties": {
        "ark": {
            "$ref": "https://raw.githubusercontent.com/UCLALibrary/sinai_metadata/master/data-model/jsonschemas/utils.json#/$defs/ark"
        },
        "type": {
            "$ref": "https://raw.githubusercontent.com/UCLALibrary/sinai_metadata/master/data-model/jsonschemas/enums.json#/$defs/agent_types"
        },
        "pref_name": {
            "type": "string",
            "minLength": 1
        },
        "alt_name": {
            "type": ["array", "null"],
            "items": {
                "type": "string",
                "minLength": 1
            },
            "unevaluatedItems": false        
        },
        "desc": {
            "$ref": "https://raw.githubusercontent.com/UCLALibrary/sinai_metadata/master/data-model/jsonschemas/utils.json#/$defs/summary"
        },
        "gender": {
            "$ref": "https://raw.githubusercontent.com/UCLALibrary/sinai_metadata/master/data-model/jsonschemas/enums.json#/$defs/genders"
        },
        "birth": {
            "$ref": "https://raw.githubusercontent.com/UCLALibrary/sinai_metadata/master/data-model/jsonschemas/utils.json#/$defs/date_core",
            "unevaluatedProperties": false
        },
        "death": {
            "$ref": "https://raw.githubusercontent.com/UCLALibrary/sinai_metadata/master/data-model/jsonschemas/utils.json#/$defs/date_core",
            "unevaluatedProperties": false
        },
        "floruit": {
            "$ref": "https://raw.githubusercontent.com/UCLALibrary/sinai_metadata/master/data-model/jsonschemas/utils.json#/$defs/date_core",
            "unevaluatedProperties": false
        },
        "rel_con": {
            "type": ["array", "null"],
            "items": {
                "$ref": "https://raw.githubusercontent.com/UCLALibrary/sinai_metadata/master/data-model/jsonschemas/utils.json#/$defs/rel_con"
            },
            "unevaluatedItems": false
        },
        "bib": {
            "type": [
                "array",
                "null"
            ],
            "items": {
                "$ref": "https://raw.githubusercontent.com/UCLALibrary/sinai_metadata/master/data-model/jsonschemas/bib.json"
            },
            "unevaluatedItems": false
        },
        "note": {
            "type": ["array", "null"],
            "items": {
                "$ref": "https://raw.githubusercontent.com/UCLALibrary/sinai_metadata/master/data-model/jsonschemas/note.json"
            },
            "unevaluatedItems": false
        },
        "assoc_name": {
            "type": ["array", "null"],
            "items": {
                "$ref": "https://raw.githubusercontent.com/UCLALibrary/sinai_metadata/master/data-model/jsonschemas/assoc_name.json"
            },
            "unevaluatedItems": false
        },
        "assoc_place": {
            "type": ["array", "null"],
            "items": {
                "$ref": "https://raw.githubusercontent.com/UCLALibrary/sinai_metadata/master/data-model/jsonschemas/assoc_place.json"
            },
            "unevaluatedItems": false
        },
        "cataloguer": {
            "type": [
                "array",
                "null"
            ],
            "items": {
                "$ref": "https://raw.githubusercontent.com/UCLALibrary/sinai_metadata/master/data-model/jsonschemas/utils.json#/$defs/cataloguer"
            },
            "unevaluatedItems": false
        }
    },
    "required": [
        "ark",
        "type",
        "pref_name"
    ],
    "unevaluatedProperties": false
}